Title,Count_of_Comments,Body,Flair
He made me watch,21,"I feel so incredibly trapped.

Two weeks ago I had an abortion and the day after I expressed I was upset he didnt ask how i was. He started the verbal abuse and its hard to remember what I had done so wrong. But I was in the shower and i said i wanted to leave. He put the shower head in my mouth and choked me after with his hands. He beat the sink with my hair dryer and cracked the porcelain. He needed to go another town and he calmed on the ride. Then I saw him texting his ex and idk I said that I knew it. We were in a woodsy area when no one around. He pushed my head to the center console and proceeded to punch the back of my neck. Almost home he said that when we get home he used to be the s*** out of me. I begged and pleaded that I would literally do anything. I fantasize about taking my pet and running to the nearest store. My car doesn't work and I didn't have a phone at the time. When we got home I took a shower again because Im only safe to cry there. I heard my pet crying. I got out of the shower to dry off and he brought my pet limp. He then held the back of my neck and made me watch punching my pet. he said that this was my fault. He grabbed a plastic bag and put it over his face. I disassociated because I believe that he was going to die. He threw him back in the cage and we went to bed. I had to pee and checked on him hurt but alive. That morning he was stiff. He made me put him in a bag and put him in the ground. His little toe was broken. I'm so scared I really don't know how to get out of this.




I originally moved in with three of my pets and they oddly died within two months. He kept buying me new ones and claimed if i left he bought them they were his. Drunk he admitted to killing all of them. And tries to apologize for brutally murdering my friend like its not completely insane


I was so sad to have to get an abortion but if i make it out my bean will never know the suffering they would have endured. I try to tell myself that much. I feel two huge losses. Im so weak to fight for safety. It all sounds so ridiculous i dont know if cops would even believe or be able to do anything for a rodent",TW Multiple Trigger Warning
What can I do,3,My ex girlfriend used to hit me and I have video of her doing it she recently came back Into my life and I need her out is there anything I can do for myself? I’m actually scared of what she can do. She used to threaten to tell the police that I would rape her when I said I would call them please someone I don’t know what to do.,TW Physical Violence
I am freaking out,15,I called the cops on my partner Monday for hitting me. They arrested him and the police officer was very rude to me and said he'd have to report this to social services because our child witnessed it. He's back in the home now but I said I dont want to be with anymore. Social services is coming tomorrow and I'm scared they're going to take my son away even though im a good mom. I'm in Colorado and they take this stuff very seriously here.,TW Physical Violence
I don't know what to do and I'm scared to report anything.,7,"Hello everyone, I do not want to reveal my identity, but for the last many years, I have been a victim of domestic Assault and I have no idea how to fix my situation. I am a women from Iran who though it would be best to move to America thinking I could find a loving husband. I found another man who already had children, but I though it would be better than being alone. I solely came for a husband. This man was also Iranian. One of his requests for marriage was for me to sign that we would not split our ownings. It was an unlooked red flag. I still signed thinking it would be better than being unmarried and I regret it. I have been hit many times after that. I had absolutely no freedom. No job, no car, and basically no money. I had to save up as much money as i could every time I went grocery shopping by getting 5-10 dollars cashback so that he wouldn't notice anything. A couple days ago he threw hot oatmeal on my face and I was burred so bad that I had to go to the hospital. Even the doctors asked me what happened. I told him everything and he told me to report him but I'm really scared and I don't know what to do. He purposely scratched/ hurt himself so that if I ever report him, I would also seem guilty of assault. I talked to a lawyer about it and he wanted 50k flat even if I lose the case. I don't know what to do. Someone please help me.",TW Physical Violence
I want to save my mother from being hurt again,2,"My brother and I came home today from an errand to find my mom crying in the bathroom with a red spot on her forehead.  She then told me that my dad hit her with his phone and even tried to throw a glass cup at her as well.  I'm assuming he threw it very hard because there's a hole in the wall and there were shards everywhere.  This abuse has happened since before I was born.  However, I'm old enough now to realize this is not right and he needs to be held accountable for his actions.  The problem is, we did not call the police.  I was stunned and could not move or do anything when she told me.  This is exactly how I would react when I was younger.  I don't know why I always freeze in fear.  

How can I help my mother? I have tried to convince her to divorce him but I don't want him to try and harm her again.  My mother said that my dad has threatened to hurt her if she ""puts my brother and I against him."" I feel guilty for not doing anything in the moment this all occured.  I'm just scared of what will come.",TW Physical Violence
"Struggling with PTSD, looking for a treatment facility equipped to handle various DV related issues.",8,"Backstory: I (31 F) was diagnosed with PTSD by my psychiatrist in 2018 after the first major physical and sexual assault occurred in a relationship which ultimately lasted a total of ~5 years. Since the abuse began, I have been living a constant cycle of leaving, missing him, reconciling, honeymoon period, escalating abuse, calling police, restraining order/legal involvement and repeat. To complicate things, I began to struggle with substance use alongside my abuser (37 M). He would enter into several treatment programs alone, and although I desperately wanted to, he would not let me go get help without him and ended up admitting with me to treatment. He got upset with the staff and told me we were leaving after 5 days.

By October 2020, the frequency and severity of abuse reached a new level, I hadn't worked in a year, was an all day/daily user and was so isolated that the only person I had contact with was my abuser. In a single moment of clarity, I decided to give life one more try. I left, went to detox and immediately drove ""home"" to another state I had left 10 years prior to start over. My abuser was arrested within a week of my departure. 

Now: I am working again at an amazing job in my career field, I am physically safe, have my own place. But I am not OK. My ex was released from jail in February, and since then, I have been spiraling and have reached out to him despite a restraining order and a no-contact order and him being on probation for 5 years for the assault (multiple offenses). I know I don't want to see him and I don't want to reconcile.

I have been on a waiting list for therapy with a local DV organization for four months. I have reached out to every crisis line, and several other organizations. I have health insurance and have reached out to therapists in the area who continuously refer me to the organizations I already reached out to or another therapist who refers me elsewhere. My symptoms are out of control, I'm starting to isolate, I have used, and I am not taking good care of myself. I don't want to do this again. I need to go somewhere safe and get better.

My question: does anyone know of or have first-hand experience with treatment centers equipped to handle DV issues, trauma, substance abuse and PTSD? I have good health insurance and the ability to take personal time off. I want to get better and move on for good. I have Googled endlessly with no real luck. 

Thank you.",TW Multiple Trigger Warning
I feel so stuck,12,"I’ve been seeing my partner for nearly a year now and it keeps getting worse and worse
The hitting has increased. The abusive, gaslighting, manipulation and constantly demanding all of my energy... I’m absolutely exhausted and I can’t do this anymore
I’ve lost so many friends because of this person because nobody wants to be around me anymore 
My best friend of 10 years distances herself entirely because she is ‘protecting her own energy’ from this 
And I feel so isolated and like I can’t reach out to anybody 
Every time we break up I have an overwhelming amount of separation anxiety and I just run back because of the trauma bond 
They have even admitted themselves that they know there is a trauma bond between us 
They are a really really intense stalker, harasser as well 
They create profiles and emails and additionally works at a centre for the national post office so they can access everyone’s private information like address and phone number 
I feel so sick and trapped and I honestly have no idea what to do, I feel like they could hurt me more if I left
Btw I’m in Melbourne Australia; every time I call 1800 respect they just tell me to leave them but it’s extremely difficult without any emotional support around me",TW Physical Violence
"TW: Physical abuse, self-harm",4,"I’m 23F, my dad just beat me up the other night because i was still up past 11:30 PM in a zoom meeting with my bestfriend listening through some network marketing. We were both not really interested but only sat in as a favor to my bestfriend because she’s trying to get a job, and the person asked her to sit through the presentation as a favor.

This isn’t the first time he beat me up for staying past 10PM, back in college he did it to me because I was up doing my plates (architecture student). 

He’d shout at me first and if i try to reason out, calmly/aggressively, he’ll start hitting my face anyway just because I was still up at night. Today he apologized to me for the first time. I don’t know what to feel. I want to run away and leave but I don’t have a job because of the pandemic. I don’t know where I could go. I don’t wanna burden my bestfriend and her family. I did self-harm for the first time last night.",TW Physical Violence
"Pregnant and married, but I want my husband to be there for the birth of our child",23,"My husband and I haven’t had the best time during my pregnancy. I’m 30 weeks pregnant and haven’t been able to let me husband back in the home for a week because of a restraining order. I want him to be there for the birth of our child in 9 weeks, I also want him around but my family is trying to keep him away from me and I’m still having anxiety attacks daily over the whole situation. 

A few months ago I confronted my husband over where our money from our savings had went. He choked me in the hallway next to our bedroom during an argument about me wanting to know what happened to it and him saying it was none of my business and I’m crazy. He also broke my laptop and iPad a few days prior and I’m a graphic designer and we don’t have much savings anymore because of the pandemic we’re very strapped for cash right now and couldn’t replace them. 

Last week we were in an argument because I wanted him to stop smoking so much weed and he called me annoying and said I need to be submissive.  Then he threw my wedding band out the window. And two days after that I was out on a two mile walk with the dog and when I got back he was in a mood and ended up hitting me several times as hard as he could in my right arm and biting me. I was so upset I called the police and now I regret it.

He suffers from PTSD and I have been trying to get him to go get treatment for it and his anger problems because 95% of the time he’s amazing. Romantic, nurturing, loving and helpful. He does things for me all the time without me asking. He’s the perfect partner 95% of the time. But being locked up together and both of us having difficulties during Covid lockdown has made us argue more then ever. 

Currently there’s a restraining order and he can’t be around me until we can change that. But the court doesn’t want to make changes until the next court date. I need that to stop now. 

Here’s my other problem. Because I went to the hospital that day my parents are extremely worried and because they are both retired they have been taking turns driving the two hour trip to where I live to keep me company. It hasn’t been that bad but I really miss my husband. 

I’m having extreme feelings of anxiety everyday and have attacks where I have trouble breathing and start crying uncontrollably. My family is almost forcing me to give up on my marriage because of all of this and I’m not ready to. Because my father was a judge for over 30 years he’s delt with many many cases and keeps telling me it’s going to keep escalating until I’m dead or my son is hurt. He thinks my husband can’t change in enough time for the birth of my son and is doing a good job of talking to me about everything during this time. I tell him honestly how I feel and he explains to me that everything I’m feeling is normal and a lot of women go through this but he’s convinced my husband will always be an abuser. 

Help. What do I do here. I love my husband... I love my son. I want to have a family with them but I also don’t want to be hurt anymore. When do I know if he’s had enough counseling?",TW Physical Violence
I'm scared of him during arguments but he said he would never hit me,22,"This post is going to be long because I'm explaining in details so sorry in advance

I'm a 20 years old girl and my boyfriend is 21. We've been together for 7 months now. We've practically moved together (he's always at my flat)

The first 3/4 months we didn't have big arguments, except one time and he yelled at me but that's all. 

But then every time he would get mad he would punch a wall or anything else(like a pillow)near me. He would push me or block me if i tried to leave the room. There's times when he says ""i'm going to slap you"" but never did.

He sometimes raises his hand like he's going to do it but stop near my face. If i cry or stop talking he would realize and apologize.

There's that time when it was getting really heated, I insulted him so he grabbed me by the back of my neck and made me walk into the bedroom then threw me on the bed. I started crying because it was the first time it got /that/ violent and I got scared to get hit. He immediatly hugged me and said ""i would never slap you"" ""you would lose your head if I did"" then he said sorry. 

Once I was mocking him(it was in a kind way, we always tease each other it's like a game, for the context he was watching a movie very boring to me and i was like ""oh god whats going to happen next im so tensed"") so he walked to me and pulled my hair then say ""im not  annoying you right now right?"" Then pulled more. ""So leave me the **** alone"" he didnt let go until i said stop it a few times.

When he's pissed(not mad just annoyed) he punches me or bites me on my arms or legs, I told him to stop but he keeps doing it. I doesnt know if he does it for fun or not

He talks and acts like he hates domestic violence and abusers, I do really believe that he only considers punching and slapping on the face as abuse and that he doesnt realize that what he does is also a form of violence 

Many people won't understand but I do not want to leave him, I believe him when he says that he would never hit me in the face.

But how do I make him understand that what he does isn't correct etheir ?",TW Physical Violence
Should I disconnect from my family?,3,"Hello, this is my first attempt at writing a post in this subreddit. The subreddirlt I had recommended this one instead to post it in. Ive read alot of stuff about family and I want to see if I'm missing something here. Yesterday something tragic happened that reconfirmed my decision to disconnect from them.

Yesterday march 15th around 1:30pm my younger  brother(22) shot up my house with my retired military/mechanic father(67) and lil sister(24) who works from home. I was at work at the time. He was high on drug we suspect LSD(won't know until the report comes back) he screamed he is God and that he will kill himself and be resurrected 3 days later- the whole religious shitload . He was disarmed by my dad after firing bullets in the house he left and ran next door and attacked our single mother neighbor and destroyed her property. Police came and was bakeracted. 

My brother has been having issues for awhile that my father chose to ignore. The blatant lying my brother has done to him and my constant warning to get him evaluated or kick him out of the house was ignored as a ""siblings argument"". I was the first to find out he had a child of 6 years but my brother got upset and lied he didn't have one. I was the first to know he was lying that he was getting a gun due to his job again he lied (he was working at a company I previously worked at that had a strict policy on whose allowed guns or not) I have footage of him at home acting crazy the day of the event. As well as previous video of him weeks prior practicing shooting with the same gun he used and bought from our father in our backyard where everyone can see him.  He wrecked my dad's car the night prior that's still in my name. 

My father never was the type to do what a parent is supposed to do. It's his only son while also being the youngest of five. So he chose to allow it to manifest into what happened today.  He let him continue down this path while putting all of us in danger. 

My brother hates me the most simple because every lie he made I saw through it. I called him out everytime and nothing happened because the whole family chaulked it up my being childish and complaining. That I have to be the bigger person-the adult. while you let your son live alternate life that finally caught up to him. He lived rent free or barely paying for anything. He gave us all digusting looks of hatred not grasping that he lived with US. No one was forcing him to stay. Again my father ignored it all.  My neighbor told me(such a sweet person) that during the ordeal he said my name and wanted to kill me. I have no doubt that I would have been the first to be shot. 

My brother had a near death experience last March and been on a religious kick due to it. It seems he was getting better. Only for it to morph 4 months in. He started screaming the ""devil get off me"" in the middle of the night, sending religious text messages of doomsday etc.im not shaming religion but the use of it is laughable because my father thought it was helping his son. 

My father got lucky with his daughters he applied the same principal of ""ignoring it and it'll work out"" to his son. And look where it got us. My father, though he was present in our  lives and married with our mother, He also didn't like to put effort in raising us. The first two daughters fucked up, but more in a stereotypical way young teens do. My little sister is the same way like our father, complacent ignores everything and live life day to day. I'm the only one who has made a effort in my life to make.a better one and is soon 2 weeks going to train before officially moving states away to work a comfortable job.  He constantly wants to boast about me as though he had a part in it. He didn't. He didn't even know about the job 2 years into the application process. It's the only accomplishment he has to his children. I refuse to let him use it. 

The whole family is the type to laugh situations off(it's the way they cope) but I refused to make the situation funny. I stood in silence for 5 hours as the investigation happened. My older sister even sense that I wasn't gonna let this slide and left. My father refuses to accept what happened. On camera, I saw my father drop his shotgun because he couldn't shoot that psycho, I saw that, in a moment of clarity he realized the monster that was created. And he was torn between what needed to be done and 'love' all the while the neighbor is being attacked. 

My uncle called and said that my brother had sent crazy religious stuff and was asking for money. And no one said anything. I can't anymore. I'm not going to stay and be the strength of the family. Like all them are saying.  I'm tired. How can you be strength when no one wants to listen? I could have came home to a house full of dead bodies. I could have came home early and been shot. I'm tired of sacrificing myself for the sake of family who even after the ordeal that took place we're still trying to ignore the problems and say that it was luck that saved him.

  My father says that he will no longer be allowed in the house. But as he said it wasn't convinced. Hes always been the type to forgive and forget the moment one if his kids says sorry. No questions asked. And with attempted murder and assault now on his record, my father still has that same principle..he would forgive my brother the moment he apologises and allowe that piece of shit back home. 

Just like everything thing else I was right about I'm right about this. So I decided to cut ties with my family in particular my father and brother. Once I leave for training I'm not gonna be the financial bearer for him or assist in anything related to it. My lil sister I told her she can always move with me if it comes to it. But she is also like my dad I can only offer her a way out. I taking the license plate off the car I gave my dad so he can't drive it until he registers it in his name. I paid my portion of the bills for the last month that I'll be home. When I said this I was gaslighted and placed as a selfish human being and that god doesn't like that.  Then well God can a have a talk with me about it when I die. But I personally think he'll understand. 

Tl:dr- psycho brother shot up home and endangered the family. Family isn't taking it seriously. I leaving them for good to fend for themselves. Should I disconnect? 

Also: my brother is only called my brother for the sake of the post. I have officially disowned him as my family.

Sorry for errors.",TW Multiple Trigger Warning
How do I deal with my paranoia?,3,"I’m always anticipating seeing my ex around every corner. I left him in early December, and I feel like I’m just waiting for him to show up. 

While my situation wasn’t very bad, I’m aware it could have quickly escalated. He never hit me, but he did get physical and threaten to kill me. I always felt like these were empty threats, but after leaving, I feel terrified constantly. I don’t think he would stalk me, or ever really come after me, but for some reason my body isn’t in sync with my head. I feel like I’m being unreasonable.

When laying in bed at night, I think that every noise I hear is him coming for me. When I’m at work I expect him to walk through the doors of the restaurant every time they open, or that he will be outside waiting for me in the parking lot. 

What are some things that have helped ease your mind after leaving, or make you feel slightly safer?",TW Physical Violence
"Last night my ex had intercourse with me, finished inside me and then pushed me to the floor while I was naked",15,"Idk... i can’t stop crying I don’t even know where to start so I’m just gonna list what he did last night and what he’s done before... 
he said he loved me I’m so confused... it hurts 

He got upset because I was texting a coworker flirting... told me I was a hoe and a bitch and to get the fuck out at 3-4 am while I’m drunk... 
- he found his address and threatened to find the guy and hurt him 
- he hit me in the head 
- grabbed my face and threw me around 
- when I locked myself in his car he pulled my hair from the window 
- I begged and begged and said I loved him to let me stay he said he doesn’t give a fuck and to get out I’m not wanted 
- he let me sleep until I was sober enough but then left on the couch took all the blankets and pillows and left me there and said I didn’t deserve a blanket

Before last night 

-Kicked me out his house numerous of times 

-He choked me and hit my head against a wall

-He put a gun to my face and made me call my friend on FaceTime to see how much of a whore I am

-Threw my phone and purse out and say I’m his and I’m not going anywhere 

-Said he could make me disappear and no one will ever see me again 

- Straddled on top of me and took both of his hands and choked me until I blacked out 

-He laughed when I woke up gasping for air 

-Threw my phone on the floor and his and said if I touch either one I’m dead 

-He’s thrown his dog across the room in front of me and kicked her repeatedly and made me watch 

-Reached his hand in my car grabbed my neck and choked me 

-Slammed my shoulder against my car door 

-Knocked me upside the head 

-Left marks on my neck that will probably scar and burn because of how hard he was choking me 

-Made me call male friends to end friendships and block them

-Shot at my friends building while I’m in the car 

-Made me tell My friend at the gas station in person won’t see him anymore and steal from the gas station 

-Poured lighter fluid all over my clothes the night before work 


I feel so pathetic and like trash. Like I’m nothing. I cried and begged I made him food. I feel so dumb.",TW Multiple Trigger Warning
