Title,Count_of_Comments,Body,Flair
I escaped a toxic relationship,20,"So this guy, (22)M and I, (20)F had been together for almost 3 years. At first I thought he was too good to be true, until a few months later he started to get really controlling, not letting me dress up, do makeup, or talk to my friends. He went into my phone, changed all my social media passwords and always made sure I hadn't logged into them. I was 17, about to turn 18. 

I ignored these red flags because I figured maybe it was something I was doing. He has trust issues because of his exes and I did too so I let it slide. Then one time we were in a heated argument and he slapped me in the mouth... I was in utter shock and didn't know what to say so I shut my mouth and listened to him. I wish I had walked out then and there.. but I let it slide again.
Next thing I knew, it started happening on a regular basis. He hit me upside the head, slapped me while I was driving, threw food on me after we had just gotten out of the drive through, he picked me up and threw me across the room.
He was emotionally and verbally abusive as well. Saying things like I deserve to be hit, that I dressed like a whore, and making fun of every single insecurity I have.. He alienated me from the outside world and eventually I was confined to the four walls of our bedroom. There was even a comforter over the window so I barely knew when it was day or night. He would leave me in there for hours and hours on end yet never let me leave the apartment or go to the bathroom on my own. 
However, I got used to this. I became comfortable and ""safe"" in this environment. Despite everyone telling me to, I didnt want to leave.. I had convinced myself that I was happy. 

But things started adding up I guess. So one morning while he was asleep I quietly packed a backpack, grabbed my dog and high tailed it to my car. I felt so sad driving away.. 

Its been a couple weeks now. Its my 20th birthday today, and I've been staying with my sister. I still feel so uncomfortable in this new environment that I get physically sick. I know I'm just missing the routine and the comfort of the apartment but I keep getting this strong urge to go back, and act like everything is okay.. how long until I start to rid him from my system...

Tl;Dr: I was a prisoner to this guy, convinced myself I was happy even though I was abused and alienated. Eventually worked up the courage to leave but I still feel sad and like I want to run back to him..",TW Physical Violence
"I feel a bit stronger, thanks for the support.",8,"After having only been on this page for a couple of days the support I have felt had been very helpful to me. I feel stronger. I realized yesterday that I could listen to love songs without thinking of him and I felt better. Last time I talked to him I said this to him:

""I think you're very smart, you've been able to take advantage of me very well and get me to care for you despite your shortcomings. You've tried to convince me I'm crazy but its not going to work. Your angry out bursts are abusive and you are physically abusive and you could've killed me. I understand that you don't see any fault in that and that you think I deserved it but this won't go on any longer. I understand how you love me, I understand that you love that you can use me whatever you want and that you think I will always come crawling back but I can't let it happen again. I am smart, I am capable and I recognize what you're doing. Goodbye.""

He tried to lovebomb me and tell me its his anger as to why he choked me and he can't change overnight and he needs more time. And he asked me to say I loved him and I said No. I told him I would call him again when he got out of jail but I'm trying to get harsher charges filed on him, the police are currently working on them. I fully intend to get him to stay there and not be able to afford bail. He doesn't know whats coming and I feel a lot safer at this point. I even feel happy not talking to him at this point. I know I shouldn't have have picked up the phone but I felt I had to say that to him and I did. Feeling lighter and better is not a feeling I've had in months and I feel like things will get better for me. I still have a lot of healing to do but I actually feel good today. Thanks to everyone who replied to my cries for help, you make me feel strong.",TW Physical Violence
Co-parenring after surviving DV..,4,"What does that even look like? My ex tried to kill me, its been 6 months since the attack happened, but we have kids together and I know at some point they will want to speak with their father. There is a restraining order for 1 year, our 2  kids  are under 10 years old and I know my ex will want to continue his relationship with them but I have no clue what co-parenting will look like after all the legal stuff is all said and done. 

Has anyone attempted to co-parent after surviving DV? How was it? Is it worth it, or should I just keep him and the kids away from each other? He was never abusive towards the kids, only with me.",TW Multiple Trigger Warning
I cannot stop doing back,49,"He called me from the jail where he is on charges took out on him for choking me and threatening to kill me. He asked for me to buy him food. I said no and he told me I was crazy, a cunt and that he puts in all the effort in our relationship for nothing in return. I finally said would do it and he apologized and said he said all of that because he's a ""savage"" and knew that so why was I surprised he acted out in anger like that. After gave him what he wanted he acted sweet and told me he would do anything to make us work. He told me he wanted to stay with me when he got out and that he finally thought of the names of our future children. I don't know how to stop answering the phone, I don't know how to stop forgetting what he's done immediately in favor of the serotonin his attention gives me, don't know how to get away. The only way I feel like I can get away from the need to be with him is if I'm dead. I just need some help.",TW Multiple Trigger Warning
"I’m planning to leave a domestic violence living situation, but not sure how to take the next steps for after that?",24,"So I have a job, money, and I’m working on a plan to get myself to a better place where I’m safe and can heal.

I’ve been in contact with shelters, but it’s been hard. I’m also only 18F and can’t drive, still in college so I don’t have a lot to my advantages.

Shelters are filled which is why I’ve been calling back to see if a space opened up, but my plan is to stay at a cheap motel or Airbnb until I can find a better situation.

I also don’t have anymore living family, and staying here worried me when the next attack will happen. Police have been called once by a neighbor who heard what happened. 

So I’m just scared about what will happen afterwards to me, if I’ll be homeless or found. What other ways can I help myself to make sure I can be safe.",Preparing To Leave
*venting* my eventful past month !!TW r*pe/ s3xu4l a55ault/ su1c1d3/d3ath/abu5e!!,1,"So a month ago i was raped, a week later i found out my friend was suicidal, my heart rat died, found out my dad planned to commit suicide, i started self-harming again, haven’t seen my younger siblings in close to a year purely because of their asshole mother, left my other younger sister to live with my alcoholic abusive mother(no way i could of taken her to live with my dad bc of her dad), had my friend walk in on her brother hanging himself & had to comfort her & lastly had my other friend that used to sexually harass me come forward about being molested. Honestly do not know how i haven’t necked myself yet, i started therapy again today though and im on meds for anxiety/depression, hoping i can heal from all this asap. im in year 11 and im pretty much failing already. Thanks 4 reading !",TW Multiple Trigger Warning
I dont have anywhere else to turn **Big Trigger Warning***,8,"My boyfriend and father of my child has been raping me almost our entire 3 year relationship. There have been periods where he has eased up on the rape, but he always goes back to it. Lately he has been ramping up again. With that said, I have flip flopped repeatedly on whether to leave in concert with his backing off or ramping up again. But today, which having (consensual) sex, he told me that it has always been a fantasy of his to find a woman who would ""let"" him rape her. He considers that I ""let"" him rape me because when I try to fight him off, I invariably give up after a time because hes too strong. Oh, and a week or two ago he raped me while I was asleep. Which I think, is a first. 
But this conversation made me realise that this is never going to end. And then I realised how very much I have to do in order to get away. I have no money. Im not working. I have no car. Im trapped. And Im distraught.",TW Multiple Trigger Warning
Disturbing realization,28,"I left my abuser and am in the healing process. Last November we were in the car at a drive in theater and I wanted to fool around. It was hot and cramped and he was having trouble performing, which I told him was not a big deal and we should just stop. But that just got him angrier. He started punching me in the back of the head saying it was my fault because I was so fat. I was lying down in the backseat on my belly. He then put his hands around my neck and started choking me. I kept reaching for the door handle but my fingers couldn’t quite get to the door handle. I kept thinking that I was going to die and no one could help me even though there were tons of cars around. I finally was able to open the door but he still was strangling me. I ended up defecating and that caused him to stop. I jumped out of the car and he was yelling at me how disgusting I was because I had pooped on his jacket. I could barely keep my eyes open and kept feeling like I was going to pass out. I would love to say I left him right after that but no it took more than 5 months to finally leave him. I told a friend today and she told me that the fact that I defecated was incredibly scary and probably meant that I was close to death. That realization scared me so bad. I mean I know it was serious but I don’t know, it hit me hard hearing that. Anyone else have something similar?",TW Physical Violence
Abuser has decided to move.... should I still move?,8,"Abuser is flatmate. I'm not the primary target, but he is mildly abusing me too and of course I have a front seat to his verbal abuse to his ex. I didn't think I could get him out so was preparing to leave myself and go dar where he couldn't find me, but now he's leaving in a couple months. 

Should I still move? Keep it on the back burner?",Preparing To Leave
looking for support,8,"last night i left my abusive partner for good, his delusional drunk states, telling me i have slept with others in his house every time i go inside to use the washroom, accusing me of doing drugs when i hadn’t, i truly believe that he convinces himself of these things when he’s drunk and has a personality disorder. when i finally had enough and went to leave out the door, he cornered me (literally in a corner) and began to cut his throat with a bread knife, somehow cutting my hand in the process. (it all seemed so fast i don’t even remember seeing him with a knife) 

i can’t tell my parents because they will hate me for going to see this man after all he has put me through. i spent all night talking to police and then drove myself to the hospital to get stitches on my hand the next day. he was holding me physically against my will every time i tried to leave and then when a friend came to help me he resorted to cutting his throat. 

i’ve been anxious all day, having flash backs, feeling really alone. i guess all i’m asking for is some words of encouragement, to know i’m not alone.",TW Physical Violence
Does this come from her abuse?,4,"My sister was in an abusive (physical and mental) relationship for 4 years. The abuse started after they hit the 1 year mark and my family and I didn’t know about it until 2 years later. She never flinched once around him or showed any signs that she was going through it. Or at least we didn’t pay attention enough to see it. After the 2 year mark, she started being aggressive with everyone, especially the boys. Not in a serious way! Just when our friends and I would make jokes and laugh to mess with her, she would slap/punch us (not in the face of course) and sometimes it would seriously hurt. Now when she did get upset at someone, it was 10x worse. She would leave bruises or scratches on people or wherever she hit them would hurt for days. It was really annoying at times and I yelled at her about it one time and she started crying and apologizing like 3 times every 5 minutes. She then went on to say that she doesn’t even realize she does it most of the time…basically she subconsciously does it. Like I said, it wasn’t really a thing until her and her ex hit 2 years.",TW Physical Violence
Court Date soon,10,"Hi, I'm 22 and I'm going to court soon over some charges I took out on my ex boyfriend and I'm feeling really conflicted. When I took out the charges they were just misdemeanors and now that I have talked to the DA and police more they're saying they want to go ahead with harsher charges based on incidents that I didnt report at the time and he's now looking at YEARS instead of months and I feel hesitant about doing all that. I told them i would cooperate in pushing for harsher charges but at the same time I don't know why I'm still worried about him. He really hurt me emotionally, mentally, financially, and physically. But I still think about how he's going to feel, how much he hates jail and how he has never gone to prison, how he's going to miss McDonald's and his daughter (not ours, we don't have kids) and his parents, And its because hes constantly told me its my fault he's in trouble and that I was stupid for telling people, and that he'll go to therapy if thats what I want. He's still deep inside my head as you can see. Maybe its the trauma bonding I don't know. But my stomach turns every time I think about court, or even just a plea deal, because he is going to be in jail for 6-12 months at the least with the charges. I just wanted to hear from someone who understands the attachment or has gone through the courts about domestic violence with stories or advice if thats possible? Thanks.",TW Multiple Trigger Warning
Is this domestic violence?,12,"A couple of weeks ago, my husband got really really drunk. I had been drinking but I wasn't super intoxicated. He ended up breaking a bunch of stuff in our room, including a window. I grew up in domestic violence and this type of behavior triggers the shit out of me. So I was walking around and laying with a broom. I don't remember exactly what led to the struggle (it was not me trying to hit him with the broom for sure) but he ended up trying to take the broom from me. There was a struggle and I got hit in the head really hard with the broom handle twice. I'm pretty sure I had a concussion because I was off balance and felt weird for 2 days. The broom hit me when he lost his grip and I was pulling it towards myself and falling down. So he didn't necessarily hit me or push me down. Just struggled with me trying to get the broom. 

There has been one other incident that I would definitely consider domestic violence, but of course his take is ""well, I didn't hit you, its not abuse"". 

Anyway was the broom handle thing domestic violence?",TW Physical Violence
What do I do,1,"So my Mom has been with my asshole stepdad for like 2 years now and they've always argued badly on a weekly basis but two months ago it was the first time he used violence. He choked my Mom and punched her. A week after that happened he did it again, and now last week when I was at my friend's house I think it might've happened again because I saw a big bruise on my mom's leg. I'm also only 13 and a girl so I'm too small to protect my Mom from my stepdad, as he is a big man. I'm too scared to call the police whenever it happens too. I've told my Mom to break up with him but she just says that he promised not to do it again etc. They're also always at the bar and only come home at night just to go back to the bar in the morning. My stepdad ALWAYS fights with her when he is drunk and I'm always stressed and on the edge because I don't want my Mom to get hurt.",TW Physical Violence
Happened Once,6,"My husband of 14 years grabbed me by the neck and pushed me up against the wall in the kitchen during an argument. He didn’t choke me at all and seemed to ‘snap out of it’ as soon as it happened and put his hands on my shoulders to hold me against the wall because I came back swinging at him.
 
This has NEVER happened before. We rarely even get to the point of real voice raising during an argument.

I shoved him away and say ‘don’t you EVER put your hands on me like that.’ and walked out of the room. 
he followed me still arguing and i turned around and said ‘yea? go ahead, put your fucking hands on me again’ and I basically lunged at him out of my own anger that he thought he could dominate me like that.
It was completely surreal and it felt like I was watching it happening to someone else. He almost never yells, he is very non confrontational as a rule. The argument was over him not helping me bring in groceries. He said I should have asked him for help and I said ‘I should’ve have to ask you for help. You eat these groceries too so you should help carry them inside without having to be told to like a child’

We finally talked about it the next day when he apologized. Of course I got the ‘you were saying anything you could to be mean and nasty to me and you wouldn’t listen’ 
i said ‘because i’d heard enough and youCANNOT put your hands on me -ever, understood?’
Then somehow the conversation turned into trying to make me feel bad for him because he’s so stressed right now that he’s turning into someone he isn’t.
So like every star of any Lifetime movie, I caved and let it go with a warning.
Later that day I started crying during a shower. He noticed I had been crying and ask what was wrong. I said ‘I don’t think I’m ok’ and i’m not.
I have never been in this situation and i’ve never known anyone in this situation . But as a friend, I would be very concerned about me. Not so much that I think it will happen again but more concerned with experiencing the trauma this clearly inflicted on me and what it’s done to my psyche, my self esteem and most of all what it’s done to the trust i had in a man that should never be that angry at me and not be able to control himself.
Can this happen? out of nowhere your spouse can get physical? and when i say he is non violent, he won’t kill bugs in the house. he’s never ever even raised a hand to me-ever 
I don’t know how to feel about this",TW Physical Violence
Im a 24-year-old yemeni national. Born and raised in UAE. My father has been abusing us ever since my sister escaped this house. We did try to escape but by law he is our sponsor and he can cancel our residency visa and deport us back to Yemen. Any advice on dealing with this?,1,,TW Physical Violence
Sisters stuck with abusive father,4,"I recently escaped from my physically/emotionally/psychologically/sexually abusive Father. My three sisters are still stuck with him and cannot afford to leave.

 I tried to involve child services but my Mom and sisters were too afraid that if it backfired he would have his lawyer take my youngest sister away from them, in which case she would have no protection from us against said abuse. So, they lied. 

They are younger than me and totally engulfed in an abused mindset so I don't blame them. But I feel awful having left them behind. They have been forced to move with him across the country and now he threatens them with homelessness every day to get what he wants out of them. I created a gofundme to help support them to live on their own but I am terrified of my parents finding it/ how my Father would treat my sister for talking to me about it if he finds out. Any ideas or advice?",TW Multiple Trigger Warning
Jealousy,5,Left my son’s father 8 months ago because he was verbally and physically abusive. Very short tempered and explosive. Always walking on egg shells. We were in no contact up until recently. He reached out and we spoke. He told me about the new girl he’s seeing and how much he likes her and how he won’t repeat old mistakes with her. Can’t help but feel jealous and why weren’t my son and I good enough for him to change? It makes me feel like maybe things would of changed had I not left. I hate that I let him get to me. I’ve made so much progress and now I just feel sad.,TW Physical Violence
What can I do?,2,"I am 26 and live with my parents and brother. My brother has repeated violent patterns including throwing things and punching holes in the walls, and a great deal of verbal abuse (today he called me a disgusting piece of shit, for example). Everyone in the house is afraid of him so he faces no consequences. My parents will not kick him out or call the cops, I have decided that I will contact police next time he assaults me (which I’m sure will happen but it could be a long time). I am wondering what I can do for now as I am unable to move out yet. I also work from home and he makes it an unpleasant environment to be in by blasting sexist and violent music. I am afraid he will hurt me if I ask him to lower the volume, and I can often still hear it over headphones/earplugs. At this point I am considering filing a noise complaint but am afraid of his reaction.
I have looked into some shelters near me but they seem to require me to be homeless and to leave my pets behind. What can I do from here? What even happens if I call the cops?",TW Physical Violence
I wish him rotten in hell.,4,"I had a very unproductive day.
I was supposed to do a few tasks but I did none, cuz I couldn't concentrate at all.
Now I can't even fall asleep.
I keep having flashbacks of how he was torturing me physically.
I remember how he punched me and kicked me, how he suffocated me, how he looked like when he spit on my face then told me I stinked, how he used a needle to pierce my fingers, how much he loved to count down and then get on me if I stayed quiet.
I remmebr when I told him I wanted to leave, he put me down immediately and slapped me nonstop. And later he said to me ""You know I can't keep you here if you wanna leave. ""
I remember his distorted face when he was angry with me.
I remember how scared I was, how panic attacks were like on me, how I curled up so I could feel a bit safe, how I tried to hurt myself to wake up from these nightmares, how much I wanted to jump through the window.
I remember I was so hurt that I couldn't even walk properly and how a man from my uni was staring at me. I remmeber I couldn't go out cuz my face was swollen from his slaps. I remember what I had to do to cover those bruises when I visited my family and his family. I remember he told me not to go to the doctor cuz he didn't believe I might have a broken rib...
I just can't stop thinking of things that happened to me. And he is not going to jail for that. I'm the one who has to suffer from all these pains.",TW Physical Violence
