Title,Count_of_Comments,Body,Flair
What should I do?,6,"TRIGGER WARNING 

Earlier today I (26f) was doing the dishes & asked my gf(30f) to bring me in the dishes from the living room. She replied with “are you serious? You’re already up” while she was playing call of duty. I responded with “you’re a loser”. She didn’t respond lightly, jumped up and said she wanted me to take her to her house, gathered her things & waiting outside. I had to clean the house up quickly before leaving (we stayed at my moms after finding out that my dad was in the hospital). Whenever I got into the car she was screaming in my face about how I called her a loser and didn’t apologize and it’s my fault that she is feeling this way right now so now I have to face the consequences. She started beating into my dash board, threw out my Bluetooth transmitter, attempted to crush an old cassette tape, all while screaming at me as I drove her 1.5 miles to her house. I asked her to get out of the car at one point after she threw out my Bluetooth transmitter. She has a history of wrecking my car. We were at a stop light when as soon as we pulled away she punched my windshield and smashed it it along with my rear view mirror. That’s when I got involved and hit her in her face. She was pissed off and I was swerving all over. I never “want” to hit her. It’s more of something I’ve had to do to stand my ground even tho hitting is completely unacceptable. I always feel like complete shit after. Alas this is not the only time she has done this while driving in my car. I don’t even get into her car cus she has no problem driving fast to scare me and slam in her brakes. Anyways. I hit her and then she eventually punched my windshield again and then again so there are 3 “fire works” in my windshield. I tried to hit her again but I missed, so I grabbed her hair and put her head down in order for her to stop completely destroying my cAr so we could get her to her house as fast as possible without smashing into someone else going the opposite direction. She stopped messing with my stuff after I let go until we got to her house where she spit in my face twice & then took me by the head and punched my twice & grabbed my glasses acting like she was going to break them. I am blind as a bat and wouldn’t have been able to drive without them. She eventually gave them back and the grabbed the shifter thing and tried ripping it out and ripping out my blinker handle thing. I tried calling the cops until I realized that I hit her. I don’t know what the fuck to do. I don’t know if I should do anything. I have her blocked in everything. Do I file a report for her to pay for my windshield and then get a protective order? Or do I just count my loss and leave it alone. I am not in a position to repair anything as I don’t feel there is a reason to go back. My father is dying of cancer & in the hospital w pneumonia and she acts like it’s nothing. There is a lack of care on her end. I am not justifying what I did or said to her. I am at my wits end & called her a loser. If it matters I am about 30 pounds lighter and 5’3, she is 5’9. I am the “fem” gf.",TW Physical Violence
Having him arrested was the HARDEST thing ever,4,"After many years of friendship we started a relationship. It just kind of happened, terrible timing too. I was moving 1200 miles away. He was supposed to come with me but didn't right away. A month later he joins me and immediately turns into Mr. Hyde. Less than 48 hours later he is arrested for aggravated harassment and I have been an absolute wreck since. I spent a week crying my eyes out, absolutely devastated that he turned into that person. All I wanted was the chance to finally be happy and I thought he was that happiness finally. Far from it. I finally woke up angry on day 8 which was also his birthday unfortunately I guess. I decided to allow him to call me through a friend and lost my shit when he said ""You said you loved me then you put me in jail""  You're damn right I did. I feared for my life as you threatened to take it multiple times. He hung up on me.  Today as I was leaving work, I had decided that I was going to visit him. Why? I have no idea. (Victims guilt? Is that a thing?) I had/have no idea what thought could possibly be accomplished besides another emotionally draining day. I even let the thought enter my head that now that he is getting mental help while in there (he had a psychotic break causing all if this) that maybe things could still work as long as he promised to continue to get help via inpatient stay. I also knew JUST how dumb this thought was and still rolled it around with conviction. Well, when I got home I checked my mail, and it made that decision for me. My protective order was in the mail. Thank you sweet baby Jesus for that ENORMOUS sign that I was being an idiot. I will admit that I do ""feel bad"" in a way because a person cant help it when mental illness rears itself especially im such a nasty and scary way, but I went ahead and put some money on his books so he can get some essentials. But that will be the last ""contact"" with him ever. Which makes me extremely sad because he was such a great friend and amazing boyfriend until this happened. 😞😞",TW Physical Violence
TERRIFIED 😞,10,Just got off phone with prosecuting attorney for my case.  I had been avoiding her for about two weeks because im honestly exhausted from dealing with my abuser and discussing it.  I gathered up the courage to call.  Informed me I’ll be answering questions for deposition.  I am absolutely scared to see him again and to talk about the day he held me hostage with a loaded gun in my mouth.   Any one ever go through the same fears and wortry bout going to court?!,TW Physical Violence
"Married a few months, argument last night turned physical",32,"Hi everyone. I realize that so so many more people on here are dealing with a lot but I’m not sure who to talk to. My husband and I got married a few months ago and we fought last night. It was completely my fault, he wanted space and after an hour I wanted to talk and wouldn’t let him leave cause he refused to speak to me and kept pretending to be sleeping. I stood in front of the door and said i wanted to talk and he grabbed me, pushed me into the dresser and threw me onto the bed. I know I should have let him be and let him out and that’s totally my bad but I still feel uneasy about this. When I rolled off the bed and sat on the floor he called me a fuckinf bitch and left for a while. He’s never hit me before and the only other thing like this that’s happened was a few days before the wedding when he pushed me out fo the way and I hit the wall. When he got home he wouldn’t say anything but I said I wanted to talk and after a while of him saying he didn’t want to I said I think we needed to cause he hurt me. He didn’t respond so I said it again and he said he heard me the first time and to shut the fuck up. I know it’s not like he beat me or punched me or anything and it’s mainly my fault but I feel gross about this. I never want fights to get like thsi I just want to talk and sort them out. He said some more hurtful things but after a while he said he was sorry and felt bad and it wouldn’t happen again. 




**also i apologize if this doesn’t count as domestic violence, if that’s the case i’ll remove it immediately, i’m not trying to say my situation is that bad i just didn’t know where to post. i’m sorry",TW Physical Violence
I might leave my abusive h/b this year. How much info do I share with our young teenage daughter....,7,"My daughter has been privy to her Dad's angry outbursts for the entirety of her life. She's tearfully pleaded with me to leave him for over a year. 
••Should I tell her any of my plans?•• 

The dv group I'm working with hasn't been very helpful... they don't have resources set up (generally speaking) for disabled  mothers. In my state, help is available based on which county one resides. A group member recently told me that I might not be able to leave my bully..er.. husband because of my poor health. That was tough,  because I was told for several years this group would help me when I was ready to leave. 

I've had 3surgeries b/c of my husband. He made me feel like a burden and feel guilty for my health issues. I spent days in bed with 1 migraine in order to avoid costly ED visits. I walked on a broken foot for years because the only treatment was surgery and my husband felt he was toov good to find job that offered best coverage. My poor daughter has seen it all. Medical, financial, verbal,  emotional abuses. She doesn't remember t the physical abuse, because I stupidly told my husband if he kept leaving marks on my body,people would know what he was doing to me. 

Anyone wondering why I haven't left after 15yrs? It's because I'm a physically disabled mother. There's no program in my state that helps people like me leave dv situations. How do we leave? Where would we go? I can't afford anything in a safe neighborhood without completely draining my savings, b/c real estate is crazy expensive.


I love my husband but he has caused me and our daughter so much pain,  suffering. My heart breaks for what my daughter is going through. 

Wondering why my family doesn't help? Oh, they do....they pray for us. That's all the help I need according to them. Meanwhile, my parents and extended family give my dual addiction... er, dual diagnosis sister most anything she asks for. Cash? Ok. Pay bills? Sure. She made bad choices that led her to the place she is now. 

My daughter has actually begun to emulate her Dad.

Well, I've clearly gone off-topic in this post. I'll delete it soon.
Thanks for reading my rant.

My beautiful, smart, limitless daughter doesn't deserve a childhood of anxiety, fear, sadness.",TW Physical Violence
I need help getting over my own emotions (TW obviously),3,"To make it short, I'm a 19 year old girl who is being abused (physically, mentally, and s\*xually) by my parents. I am getting things together so I can leave, and the biggest thing stopping me is the feeling that I'm being horrible to my parents by leaving without warning (I plan on leaving a note). Anything I can do to help that?",TW Multiple Trigger Warning
"I got my boyfriend/ex arrested today, and I don’t know how to feel about it.",9,"I’m not sure how to flair this properly so please forgive me. 

My boyfriend or probably now ex was an ex junkie and was in recovery for some time, and had a successful year with me. Due to Covid and car problems and family issues he endured he relapsed because of suicidal tendencies and what not. Over the last year and a half I’ve been going through physical and mental abuse. My credit is down the drain I currently am living with my mother where we both were in the living room after he got us kicked out from his family’s home where we had a small place. 
He would blow up, drive away etc using my car that’s under my name. 
We have found spoons and baggies which he claims were old yet just now I found more spoons. 
Anyways it’s been just too much to even list what he’s done to me, but today he got mad that my mother found another spoon(which honestly he was eating pudding and left it somewhere because I watched him), and started to go off at me because of it. I tried to calm him down and explained if he’s not calm enough he won’t be able to keep the car because the roomates wanted him out by the end of this week and I wanted to help him find somewhere to stay. This morning I hid the key and told him good luck on going to work because I hid it cause I feared he wouldn’t come back with it. He threatened to Hotwire the car in which I said no, got into a heated argument and I hit him because he kept yelling every name in the book at me. In which he threw me across everywhere and whatnot I ignored it and ran to the car to prevent him from taking it. He pulled me by the hair and threw me on the side walked punched and kicked me which the neighbor got on her door bell ring video. 
Cops come I explained what happened and thankfully since he assaulted me they could look for him to find the car too. 
He calls me from a random number as I was still talking to the cops and I convinced him to come back while they were on standby. He’s bipolar so he came back calmer and I just felt so bad I had to call the cops and say he was here. 
He yelled that I ruined his life and he hopes I die etc. 
I’m debating on bailing him out but I know that would be just as dumb. 
He had so much potential and I don’t want to ruin his life and want him to succeed in life but it wasn’t working out at all. 
I don’t know what to do or how to feel I truly feel like if I didn’t hide the key or just waited on him to come back it wouldn’t have come to this. 
What do I do from here on?",TW Multiple Trigger Warning
I've been recommended to post here,11,"I posted this on r/relationships and it was removed and said it was better suited to here. To be clear, I don't think I'm a victim of domestic violence but I really need help and don't know where to go. I guess I am starting to get quite scared of him though.

How can I (29f) help my husband (32m) through this rough patch and also keep my own sanity? And how can I hide this from my kids (6f 2f and 2month old f) 

My husband (32m) has been struggling with his mental health for almost a year now. He has been to see a doctor and has been put on some strong anti anxiety and anti depressants. We currently can not see a therapist because of money reasons. 

He has been taking money from our credit card (I don't have access to see our credit card statements) for months without me realizing and spending it on crypto currency and then pretty much losing it. He has taken about $5k in the last month and has nothing to show for it.  We are struggling with money right now and I don't understand why he keeps doing this. I snooped though his phone to find his out because he want telling me why our credit card payments have been so high recently. He keeps saying that he knows what he is doing and his is how we are going to free ourselves of money problems. 
I guess I do believe him that he knows what he is doing and that he's just having a bad couple of months but it's really hard to be supportive when I don't have enough money to feed our family and he keeps lying to me about where our money goes.

The biggest thing though is his anger. He is starting to get really angry at me especially. Nothing physical, although he did get a bit physical while I was pregnant with my middle child but that hasn't happend since.
He's starting yelling and screaming at me whenever I get upset about something. For example, I'm not feeling well at the moment and I usually pretty much do everything around the house but tonight I was lying down on the couch after the eldest two went to bed and my husband was holding our baby. He told me he needed 15 minutes quiet time and then he'll do all the end of the night jobs (dishes, organizing daycare stuff for next day, feeding the cat etc) and gave me the baby and he went down to our room. 
After an hour I went down there to get something and he came back out with me. I was doing the jobs because it was starting to get late and I honestly didn't think he would do them as he doesn't often keep promises. He asked me what was wrong and I told him I'm super overwhelmed, unwell and tired. He absolutely lost it at me and kept screaming at me to ""shut the fuck up"" over and over and told me I'm and ""fucking ungrateful bitch"" 
My 6 year old woke up during this and heard everything. I don't know what to say to her to make it better

I'm so tired of this and I've told him I can't handle this anymore. He always tells me that if wasn't for me then he will kill himself. I believe him too because he's not really well in the head. I'm so lost on what to do.. please help me.

Tl;Dr
Husband is struggling with mental health and it's taking a toll on me. I want to help him but he's starting to get very angry at me and I'm starting to feel resentment towards him.",TW Physical Violence
Detective thinks I coached the kids to talk about sexual abuse,8,"In the middle of a divorce from a covert Narc. After a school official witnessed an altercation, Children services got involved.  

For the first time I felt like I had the freedom to protect my kids... then, one of my kids tells me about a night I had worried about since it happened.  I reported it.  Months later after all the exams and interviews, Children Services says they were confirming the physical abuse but not the sexual, primarily because they didn’t have a third party reporter.  A few days later (last week), another child of mine tells me their father did the same thing for many years!   I ask the attorney and they said the detective thinks I coached my kid to say it so they didn’t have to see their father.  

I take the second one to the Psych today and inform the doctor that the child and I were having a conversation and they had indicated there were some things that sounded like they could be child sexual abuse. I asked the doctor if they could take the conversation from there.  

The doctor literally raised their hands and said “I am not an investigator nor will I even discuss it with you.  You’re going to have to make that call all on your own.” 

I’m livid because I’m trying to do right by my kids and I’m getting pegged as a vindictive ex.  

By the way, that line of thinking is completely false.   Child abuse = Jail = Ex husband having no job = no child support and no alimony.  

I’ve been a SAHM for way too many years and survive on his income.  

What do I need to do to help my children and not lose them in the process?!",TW Multiple Trigger Warning
Who do I pick for my support person when I give birth,5,"I only get one person because of Covid. I have a restraining order currently against my husband because he hurt me really bad physically while I was 7 months pregnant. I’m 35 weeks now and I don’t know who I want to be there at the hospital with me. 

Most of me wants my husband to be there and I could have the court change the RO to allow him to be there for that. But then again he’s not any better than he was and I’ve been coming to the realization our relationship is over due to my own safety and more importantly the safety of my child. 

My mom wants to be there, but I’m not sure I want her to be my support person. I have two best friends that hate eachother that both want to be that person for me. One lives 4 hours away and is pregnant herself. The other one lives 11 minutes away but she recently made a weird comment to me that kinda threw me off. 

Both my mom and my two best friends have made odd comments about my husband but I can’t blame them for that but I just worry they will look at my son differently. 

I’m just very protective of the idea of who’s going to be around my son. And I’m kinda wondering if I just want to do it alone? I don’t know how i am going to do this. But all of this just makes me want my husband there but that’s not a realistic idea either. 

Anyways my mom and I and my two best friends are white. And my husband is black. And I don’t want anyone around me to say anything race related after he’s born and I don’t know if I trust any of them with that sensitive part because they all just say whatever is on their mind.",TW Physical Violence
Does my abuser deserve punishment?,10,"My ex bf was put on probation for domestic violence. He shoved me causing me to fall and hit my head. A time before that he pushed me on the ground and I fell and scraped up my knee. So now he is ordered to not contact me and if he does, he will go straight to jail. 

Well unfortunately I contacted him first after a month and said sorry. I missed him and I actually felt bad for calling the cops on him bc he never beat me or anything terrible. He begged for us to get back together, that everything would be perfect and blah blah. So we started dating again but things are starting to get bad again. He has not hit me or been physical with me, but the emotional and verbal abuse is BY FAR the worst.

When I try breaking up with him or blocking him he does not leave me alone. He will find other ways to contact me and harass me. I have told him if he does anything wrong (like touches me or verbally assaults me, anything like that) I will report him that is he now in contact with me, which would send him to jail. Am I being unfair???

I never actually did report him so he just doesn’t believe me. He said if I do he will kill himself. I honestly now feel so much resentment for all the shit he has put me through in the past and always letting him get away with it or making up for it by giving me gifts and stuff. At this point I am so mentally exhausted and damaged bc of this man. 

I feel like it’s my fault for getting the both of us into this situation and going back to him, so it would be wrong of me to tell on him. I also hold back from doing so because this will mean if he goes to jail, he will also lose his job and home and I’m not sure who would take care of his 2 dogs who are getting really old. :(

Basically I’m not sure if I’m just being unfair in this situation and he doesn’t deserve that harsh of a punishment or if I’m being too nice. Any advice from you guys would be very appreciated!",TW Physical Violence
[F23]I don’t know what to do. He left a bruise on me.,22,"My boyfriend and I argue often, and when it gets heated he gets violent. He’s never hit me but he grabs me hard when he’s mad at me.  He once grabbed me and threw me off the couch. I had bruises over my arm and back. He vowed not to do it again and I’m afraid..... 

I have video and photo evidence. Is this enough to file a report? I feel like it’s not enough for them to care. Any input or experience? 

TIA ❤️",TW Physical Violence
Abuser is threatening to take my child,27,"I’m 6 months pregnant and after he beat me up a few weeks ago, I decided to leave... and then I went back but now everything has gone to shit and I’m just done foreal but he’s been threatening me to take me to court to get custody. I’m scared I don’t want him to have access to my child. Luckily he doesn’t know where I’m giving birth or where I will be moving to before the baby gets here and I just changed my number... but I’m still worried.",TW Physical Violence
Left my abuser and he’s begging me to come back.,11,"I finally upped and walked out on my abusive ex of 1 year. Only returned once to pick up my belongings when I knew he wouldn’t be home.

He never hit me. BUT he cursed me out, called me the worst names in the book, constantly accused me of lying and cheating, was a problem binge drinker, did hard drugs. He didn’t work, had double standards, dismissed my concerns, had terrifying rage outbursts over the smallest thing, screamed in my face multiple times, threatened breaking up on the reg, everything was my fault, has thrown things (not directly at me), overturned and smashed furniture, and he was slowly isolating me from my entire support system. 

We broke up once and he threatened suicide and promised to change. I went back after a day. He was good for a couple weeks. Then it started again and gradually got worse. 

In an alcoholic rage, he threatened to kick me out of the car into the middle of a highway twice, at 2am. He has blocked my path and cornered me during a couple arguments. Pressured me for sex when I was clearly exhausted/sick and would pout and accuse me of not loving him when I refused over and over. Guilt trips out the wazoo. Misogynistic and racist comments and beliefs. 

The last straw finally came when I sat and cried in front of him, begging him to believe me that I loved him and never cheated. And he stared at me with the coldest expression. And then laughed at me. 

Of course, as with all abusive relationships, in good moments, he was fun, loving, sweet, kind and generous. Those times, I was so hopeful things were getting better and he would go back to being the person I fell in love with. 

He’s also physically disabled, but very mobile and independent, and I was attracted to his drive and ambition, and he came off very well adjusted and mature. 

It’s been 5 days, and he’s been begging me to come back. Promises of change, that he’ll do anything to fix it. Promised to go to therapy, to AA, and get rid of all his enabling friends and family. Leaves me voicemails crying and apologizing repeatedly and saying he messed up bad, he can’t lose me, I’m his entire world. Everything I wanted him to do and wanted to hear. I stopped responding to him 3 days ago. He says he knows he’s lost me for real this time and he said it was a wake-up call.

I need to stay strong and since we live together, I’m trying to get out of the shared lease on the basis of DV. I guarantee his demeanor will change once he accepts I’m serious and he’s going to be stuck with the expensive place that HE picked to live in. 

I do have hopes he will change, but I’m not holding my breath. I know people can change. I’m in therapy working on myself and doing the hard work and facing the worst parts of myself. 

Should I just stay NC? Or would it be worth it to send him one last message telling him to get himself into an abuser program? I’m not planning on going back, but I do want to hear your stories and just need some overall support. Thank you for reading all of it 🙏",TW Multiple Trigger Warning
