Title,Count_of_Comments,Body,Flair
Bitter sweet,3,"I have been married to a drugged out, controlling, abusive man for 6 years.. I have been kidnapped, beat, choked to unconsciousness, controlled, defamed, and had houses destroyed, sent to jail. He has called child services on me and much more.. I felt trapped, scared, and alone seeing that his family hates me. I filed for divorce and he threatened to kill me.. He kept sending police to my home...I CRIED everyday... The police got tired of him and caught on... They help me get a TPO.. I reported every call.. every unannounced visit , every threat... They put a warrant on him.. I went to court yesterday ... And he had the audacity to show up.... I was shaking... I got a year of protection, child support and I got to watch them LOCK HIS ASS UP. I felt so much relief. An abuser is strongest when you fear them... I couldn't take any more... He begged and pleaded like I had for years... I'm free... To those who fear talk to an investigator and fight back... To many people die because they keep things in.. I tell my Dad and my bestie everything... I will not be a victim anymore.",TW Multiple Trigger Warning
I’M STILL STANDING,2,"You must’ve had an inclination to beat me down. You must’ve been threatened. 

You physically beat me. You tried to convince me that I was mentally incapable, that I was crazy, that I was a bitch. EVERYTHING was the problem except for my boyfriend 🤷

You called my therapy stupid. You were discouraging and mean when I quit drinking. You put down my friends and family. 


You jeopardized my work. You screamed at me right through meetings. You SHATTERED my work computer.


But guess what… IT DID NOT WORK.


I ❤️❤️❤️ MYSELF. I am doing quite well at my job. My body is better. My mind is better. I’m NOT CONTROLLED BY ALCOHOL ANYMORE. I am finally in control of my life. I’m RICH and I have my very own self to thank for that. I know the signs and signals of asshole men. I’m smarter and wiser. I have the capability of helping out other women in this situation. 

it really is true that what doesn’t kill you makes you stronger. And I’m PROUD OF MYSELF for getting out of this relationship before it eventually killed me.",TW Physical Violence
Best Background Check for Marriage Records,5,"I am a DV victim and was relocated with my child. My perp is still on probation for six more months. He recently reached out after nearly a year suddenly wanting to be a dad. At this point I don’t have to allow it because our child is really little and video calls put me in a precarious position and haven’t gone well in the past.

Long story short is that this guys anger stems from seeking sex with men on the downlow, and a long history of hiding his sexuality behind a woman. He was violent and convicted of DV with his ex wife due to these issues.

I have reason to believe he has remarried again to a woman who is probably unsuspecting and that is why he now wants to play happy families.

I have been told by therapists that as long as he keeps “ bearding up” with women he will always be violent with them. He has only been with a few women and violent with every one of them.

He has put us through so much and I had to rebuild my life alone with an infant in a state where I knew no one. I lost everything and am doing really well and don’t want him near my child. I worry about what will happen when his probation is up and custody. He has no physical custody, lives in another state, but is on the birth certificate and has joint legal. 

I am seeking help from the DV shelter for advocacy and guidance but wanted to try to find marriage records online. There are many options for records out there but if I am going to spend money I want to make sure I’m getting accurate and current info and wonder if any of you have walked through doing a background check like this on your perp?

I did do a court search and have the info that he has been compliant with the court during his two years probation, but has had two traffic tickets for not wearing a seatbelt and speeding during this time. I want to be as informed and prepared as I can be, and have a clear picture of what I’m dealing with.

I am going to",TW Physical Violence
Let’s imagine we got married instead of breaking up,2,"I’m guessing i’d still be the only one working, he’d be between not working at all and working dumb odd jobs that he’s constantly getting fired from. Yet i’d probably still be offering him my house, food, weed, car. At the same time he’d be SCOFFING at any suggestion that he’s not an amazing husband and provider. 


He’d still be beating me. If we had kids, I’d imagine they’d be in a truly horrific situation. He’d still be a raging alcoholic probably, I quit 6 months ago (after he assaulted me and threatened me with a weapon). I’d imagine I’d be fleeing from the apartment that I pay for off to safety with my children on a regular basis. He’d still be borrowing my car and leaving it full of fast food garbage and liquor bottles. He’d be hitting on my friends and family behind my back. If he wasn’t hitting on them, he’d be trying to shake them down. 

Good thing I wisened up and kicked that mf out. 👍🏼",TW Physical Violence
New Here,2,"Hey guys, I guess I’m just looking for some kind of community here. I never found anyone to talk to about what I’ve been through. I don’t know if anyone has been through this but....has it ever been months since they put their hands on you? And for whatever reason due to whatever circumstances you believe that they have somewhat changed? Or even sincerely apologized? And then they do it again in some capacity? I’m in the aftermath after they’ve driven away and I’m here scared, confused, not sure what to do.",TW Physical Violence
Says “I don’t hurt women” without any shame about how much of a lie that is,7,"To you do none of the following count as “hurting women”

- physical violence resulting in bruises
- physical violence resulting in blood
- physical violence resulting in me getting a black eye and needing surgery
- violently breaking my computer
- calling me a bitch/ ho / crazy
- trying to tell me multiple times that I’m mentally retarded (nothing wrong with that but I’m not) and that I only see the above things as abuse because of how retarded I am (completely wrong )
- TELLING ME I DESERVED IT 


Go to HELL and stay away from me forever",TW Physical Violence
Horrific emotional and physical abuse- blames and Shames me,10,"

The fight all started over him telling me to cut off 4 of my/our friends out of absolutely nowhere. He was ranting and raving and threatening them. He spit on my face, punched a cabinet, then grabbed his assault rifle. I threw my body on the case to stop him from getting it open, he violently tried to get me off the case to get to the gun which left me covered in bruises. He was in a rage, he didn’t even seem human. He then fled with the gun in his car and I tried to get In the car to stop him driving off and killing himself, he physically threw me out of it and then floored the accelerator from a standstill and veered the car hard into the road so I was thrown from the vehicle and about to go under tires when my neighbor came out of his house screaming for him to stop. He said “i knew you just wanted to ruin my life and get me in trouble with the cops.” Of course I didn’t want to, so I tried to protect him with the police so his military career would not be affected. Afterwards I would gently ask that he acknowledge and get help (discreetly) for the physical abuse and threats of suicide. He said he’d divorce me if I used the word abuse and denied or blamed me for what happened that night. We had been married just 3 weeks. He had to go away for work for two weeks and was acting so cruel and remorseless and telling me not to talk to anyone about it or we wouldn’t be able to work things out.. I decided not to speak to him while he was gone for work for 10 days, and after just 3 days of some half hearted attempts to reach me he reactively filed for divorce to hurt me, to try to control the narrative (that if I said anything about that night it was because I was vindictive and angry about him filing for divorce), but he didn’t tell me he filed. The day he filed, I also received anonymous gifts from him in the mail. I am devastated. There was another instance of cruelty last year (forced abortion- during pandemic on my 36th birthday for a child we both wanted and then he changed his mind- horrific) but after 6 months apart he got help and took full accountability and it really helped me heal. Now this.  Thankfully I had spoken to a victim advocacy program in the military and decided to unrestrict my report so they could do a full investigation. The evidence is overwhelming. He will then be mandated into treatment and will also likely be separated from the army and possibly charged. I want to work things out once he had treatment and hopefully gets a diagnosis (BPD? NPD? CPTSD for sure). But he will probably hate me for ruining his life. Help.",TW Multiple Trigger Warning
Is this abuse? Need advice,10," Today my fiancé(35 m) shoved my(26f) shoulder back pretty hard to the point I stumbled backwards a couple steps. I was yelling at him because he let in a huge mosquito, and I was trying to kill it with Lysol spray. But he was trying to catch it in a cup to let it outside. I just wanted it dead because I hate mosquitos especially in my house. So I reached my arm up to proceed to kill it with the spray. While he was still looking up at the bug while standing next to me, that’s when he shoved my shoulder back after he noticed I tried to kill it.  He had never put his hands on me before but I got extremely upset and started to cry not because I was in physical pain but emotionally it felt like he was putting a bugs safety over me. He was saying he didn’t realize how hard he pushed me and that he thought it was evil I would spray a living thing and torture it by burning it to death. I told him he sounds psychotic and I don’t know if this is abuse or not. He told me he has grabbed his ex by the throat when she cheated on him and has also grabbed his mother by the throat while she was drunk. I always told myself he would never put his hands on me like he did to them, and it was only a shove. We weren’t exactly in a face to face argument but he clearly shoved me to stop me from doing something. Is this a red flag?",TW Physical Violence
Please Help.,5,"Hello.

I am a teen. My brothers are physically abusive to me and my other brother T. The names of those are 2. L and Q. L is 22 and Q is 18. Q and L are very abusive to me. They beat me up and humiliate me for simple things that are kind of harmless. A time L beat me up for simply not getting him his shoes because I was busy. Today I was humiliated and slapped by Q for simply washing my hands in the kitchen. The excuse was ""why don't you wash your hands in the bathroom you shame? The Kitchen sink is not for washing your dirty hands."" Or 3 years ago when I had to go to a school that was very crappy. You'd get hit by rulers and yelled at if you don't complete homework. They weren't nice at all. A time In those days I said to myself ""F\*ck it I'm not going to school today."" So I used a technique where I'd say ""I want to take a s\*hit gimme 1 sec."" then I'd go to the bathroom and lock myself. Then I'd wait for the buss to go. Then the buss came and my brother L told me to open the door but I tried to say no but I was scared so I open it but still didn't go. Well now he beat the s\*hit out of me and even took my clothes and left me with my boxers. and many many many countless stories happened to me involving domestic violence. But now I'm sick of it, I'm tired of it, I just want someone to help me. I still wanna stay with my family but I don't want to be abused, Please help ;\_;",TW Physical Violence
My husband threatened the lives of me and his kid. It’s like his family is living in a different reality,20,"Last Saturday, my husband was arrested for throwing me around the kitchen with our son in his arms, then later pointing a loaded 12 gauge shotgun at me with the safety off. When he pulled the gun I was holding our toddler, so I ran out of the house with the baby, shoeless on our road and hid behind the closest neighbors work barn, all the while scared that the neighbor might shoot me too for trespassing. 

While my son wasn’t severely injured, my husband was charged with a felony for injuring him recklessly, as well as 3 misdemeanor. Either way, he was on probation when he did this and is looking at serious prison time. Im fortunate that I was the one who had the visible injuries and not the baby. When the sheriffs department showed up, they had to draw their guns on him because he was still holding the firearm on our back porch. 

When they told me the gun was loaded I wanted to puke. This was someone who was familiar with firearms all his life, taught me how to shoot, taught me the basics of “safety always on, always treat it like it’s loaded, and never point it at something you don’t want dead or a hole through.” He was pointing it at me and the baby.  The scariest part was the rage he had on his face while assaulting me was gone, when he had the gun it was totally devoid of emotion. I think that will always be something burned into my memory. 

My son and I were granted an EPO, and CPS came and wrote up a safety plan for my son and I. Because I don’t have family in the state we were living, I am going to my home state and staying with my parents indefinitely. Thankfully, he can’t cry kidnapping because he has no rights as long as the protective order is in place. 

I plan to file for a restraining order when I get to my parents home, and was given resources to free legal services. I began the divorce process yesterday. 

I’m sure I’ll give less of a shit when I’m home with my family, but I swear my in laws are out of their fucking minds. They really think it’s possible for us to reconcile. One went as far to try to tell me that I shouldn’t talk to CPS because I’m on anxiety medication and they can take the baby, as if my proactivity for my mental health is a danger to my son like pulling a gun is. My social worker scoffed when I told her that. My mother in law told me my husband is heartbroken that the felony charge he is facing is related to him hurting the baby, and asked if there was anything I could do to call them and tell them that he’d never hurt our son on purpose. I told her, no, because that’s what the reckless part covers. It doesn’t matter that he didn’t mean to step on/knock the baby over while he was beating me up, it means he did while doing something dangerous and wrong. I shit you not, my father in law called me the night of and tried to make it a “it’s both of y’all” thing and make me feel guilty that I called the cops and he’s probably going to do prison time. 

I know family is biased but they are on another planet. Do they not understand that their son/brother/whatever could’ve gone from drunk wife beater to convicted murderer? Of his son no less? 

Idk, but I had to block all but one. The delusion is disgusting, disrespectful and disturbing. I can’t take it",TW Multiple Trigger Warning
UK Reported to the police now that I'm out and safe but advice needed.,3,"TW physical, emotional, sexual. Please dont read on if any of that will trigger you, I need advice but not at the expense of your emotional peace. 
.
.
.
.
.
.
.
.
.
.

My previous posts outline a lot but for a TLDR I was in an emotionally and physically abusive relationship for 3 years, a couple of weeks before I left he raped me, tried it on a lot while I was awake, he was drunk, I wasn't. I told him no VERY forecefully, I'd already told him I was gay previously, and then woke up to him doing stuff a few hours later, I knew I was leaving and didn't want to risk him kicking off so didnt resist. I have photos of injuries in 2019 and some videos of him being verbally abusive. I managed to get out at the beginning of May and he has no idea where I am. 


A MARAC was filled out when I got to the new city and the police were alerted to my situation. I've decided; after much deliberation, to cooperate with the police. I have an initial account on video in my home, he thinks there's enough evidence and it's serious enough to take to CPS and charge him. The detective has referred me to the department that deals with sexual abuse and I am going to give a formal statement of all of the abuse on video in 2 weeks in a sexual assault centre. 

The officer will be male, I've requested a woman but there aren't enough for me to have one. He seems lovely but it's not ideal. I've been told the centre staff will support me before and after but I have to be alone with the DC when I give my statement. I'm very confused, when they question him (that's the intention and there's a warrant for his arrest in the area I live in now) he will be entitled to have a legal representation present. Why do I have to be on my own? 

I have various mental health issues, he made a habit of pushing me and pushing me until I lost it, he'd then record me shouting and being erratic. He's told me all along that if I go to the police he will show them all the video evidence he has of me ""being an abusive lunatic"". I'm not naive, I know this will go against me, it's my word against his of why I got to that point. 

What should I expect? How the fuck do I get through this without having a breakdown? How long will this all take. I'm just scared, once he is questioned he will know the city I've moved to based on who is interviewing him, the police have agreed to give me an alarm system for my person and for my home. But I'm so so scared he's going to find a way to get to me or just try to mess with my head. 

He'd have killed me if I stayed. I need to make sure he can't do this to another woman. He thinks he's the victim, he's so messed up.",TW Multiple Trigger Warning
Help my ex wants to buy a car off of me but I don’t want contact I’m scared,10,"Can anyone give me advice on this...? Background: My ex was abusive physically, emotionally, and financially. He’s double my size, and has a gun. I’ve left him over a year ago. 

Now to my problem:
My first car that I got (handed down from my mom) was basically thrashed by him. He manipulated me into using it all day everyday. He has got into many car accidents (his fault) and his anger issues caused him to destroy the inside as well. 
My family and I gave up on that car because it caused a lot of tension in our family and it’s just plain bad memories. It’s been sitting near his friends house for a year now with no one using it. 

So he now needs a car and wants to buy my old one off of us for some odd reason. The car probably doesn’t even fucking work. 
Today he texted me: I have money for the car to give to your mom. Fuck it I’m coming to your house. 

This scared the shit out of me. I’m scared of him. Not to mention I’m home alone right now. I managed to get him to stop trying to come to my house by saying “Let me talk to my parents about it so wait.” 

I DON’T want to sell him the car because I don’t want me or my parents to ever come in contact with him again.

I’m afraid if I flat out refuse to sell him the car, he may get angry and try to do something to me or my property. 

What can I do or say in this situation? 
Or even something that would require us to have no contact at all even with selling the car ? Any ideas? 

Please help I’m having a panic attack 
I’m sorry this is long


TLDR: my abusive ex wants to buy a car off of me and I don’t want contact with him. I’m scared he’ll do something if I say no.",TW Physical Violence
Changed behavior,7,"My ex [34 year old male] and i [27 year old female] have been separated sincr march following a domestic violence incident. 
We take plenty of time apart but still see one other occasionally. 
My family doesnt know I've been in contact with him and still seeing him which is a hard secret to keep.

I am feeling like he is sincere in taking all the actions needed to prove to me that he will never make that mistake again.

Forgivenss is a hard road but I feel myself forgiving him more and more each day, believing in my heart that people have the capacity to change.

We were living such a wonderful life together for 2 years before the incident and I am not ready to give that up.

Do you believe in changed behavior or one time incidents?",TW Physical Violence
Got my husband arrested on Sunday- I feel miserable,6,"I got my husband arrested on Sunday, We had a terrible weekend, which all came to a head on Sunday night with him grabbing me by my throat, pushing me backwards, then taking me by my hair and throat and shoving/throwing me forward into the couch.   


My husband stopped me from calling the cops, so he could place the call himself. He said he was going to have me arrested, but I didn't care who called so long as the call was made. It's a long story, but he was arrested, saw a judge, released and back home.   


I'm writing right now because I'm incredibly depressed. I'm  miserable. I can't figure out what to do because he truly honestly can't believe he was arrested. He truly believes I had him falsely arrested. He truly believes the officers treated him unjustly. I don't know how to handle that information. How? If every other time it was an apology and knowing you did wrong and don't leave i'll change- how is it now that you did nothing wrong? How is that even possible?  


I don't get how he didn't think he could be arrested for pushing shoving and hitting me? He told me that ""Whatever you said got me arrested. They didnt' tell me what you said."" I just stared at him. I was and am still so confused. I told him that I told them the truth of what happened. I told them the whole truth- I even went all the way back and started on Friday so nothing would be forgotten and they had an exact timeline. Step by step, word for word, I could even give them timing for the moments I checked the clock and had something done at that time (like I checked the time and say it was 907pm so I told him he had some time to get to the store to grab a case of water). My husband didn't say anything- just grumbled that it was bullshit. He said- I just don't understand how you hit me on the head with a bag and I get arrested. I just stared. I didn't hit him on the head with a bag. We were arguing about turning the TV off and he got angry. He didn't want the TV off- I needed to have it off there was too much auditory stimulation. He'd watched TV all day- I woke up at 7-8am he was watching TV, we as a family left for the zoo around 12pm, arrived back home around 5-6pm, I took myself out (never walked into the house) got back around 7pmish he was watching TV. It was around 940-10pmish when I asked him to turn the TV off.",TW Physical Violence
I need to start a new life…,6,"just get away from this controlling man… I’m so annoyed I have to give up everything and move. I really don’t want to go in a refuge. I was going to save hard and leave but I don’t think that’s going to work.. I hate being this scared zombie.. afraid to even be myself.
I can’t even speak with friends or laugh without his backlash. 
I know I have to go.. I hope I can push myself through but my feet are heavy.",Preparing To Leave
